symbol,name,address1,address2,industry,summary
HSY,Hershey Co.,19 East Chocolate Avenue,"Hershey, Pennsylvania 17033-9524",Food Products,"The Hershey Co. engages in the manufacture and marketing of chocolate, sweets, mints and confectionery products. The firm operates through the following geographical segments: North America and International and Other. The North America is responsible for the traditional chocolate and non-chocolate confectionery market position of the company, as well as its grocery and snacks market positions, in the United States and Canada. The International and Other segment includes the combination of all other operating segments, including those geographic regions where the company operates outside of North America. Its brands include Hershey's, Reese's, and Kisses. The company was founded by Milton S. Hershey in 1894 and is headquartered in Hershey, PA."
HES,Hess Corp.,1185 Avenue of the Americas,40th floor,Major Oil & Natural Gas Companies,"Hess Corp is an exploration and production company, which engages in exploration, development, production, transportation, purchase & sale of crude oil, natural gas liquids and natural gas with production operations. It operates through the following segments: Exploration and Production and Midstream. The Exploration and Production segment explores for, develops, produces, purchases and sells crude oil, natural gas liquids and natural gas. The Midstream segment provides fee-based services including crude oil and natural gas gathering, processing of natural gas and the fractionation of natural gas liquids, transportation of crude oil by rail car, terminaling and loading crude oil and natural gas liquids, and the storage and terminaling of propane, primarily in the Bakken shale play of North Dakota. The company was founded by Leon Hess in 1920 and is headquartered in New York, NY."
HPE,Hewlett Packard Enterprise Co.,1701 East Mossy Oaks Road,"Spring, Texas 77389",Computers/Consumer Electronics,"Hewlett Packard Enterprise Co. is a global edge-to-cloud company, which engages in the provision of information technology, technology and enterprise products, solutions, and services. It operates through the following segments: Compute, High Performance Computing & Artificial Intelligence (HPC and AI), Storage, Intelligent Edge, Financial Services, and Corporate Investments and Other. The Compute segment includes both general purpose servers for multi-workload computing and workload optimized servers to offer the best performance and value for demanding applications. The HPC and AI segment offers standard and custom hardware and software solutions designed to support specific use cases. The Storage segment provides workload optimized storage product and service offerings, which include an intelligent hyperconverged infrastructure with HPE Nimble Storage dHCI and HPE SimpliVity. The Intelligent Edge segment offers wired and wireless local area network, campus and data center switching, software-defined wide-area-network, network security, and associated services to enable secure connectivity for businesses of any size. The Financial Services segment provides flexible investment solutions, such as leasing, financing, IT consumption, utility programs, and asset management services for customers that facilitate technology deployment models and the acquisition of complete IT solutions, including hardware, software, and services from Hewlett Packard Enterprise and others. The Corporate Investments and Other segment includes the A & PS business that primarily offers consultative-led services, HPE and partner technology expertise and advice, implementation services as well as complex solution engagement capabilities, the Communications and Media Solutions business, the HPE Software business, and Hewlett Packard Labs. The company was founded on July 2, 1939 and is headquartered in Spring, TX."
HLT,Hilton Worldwide Holdings Inc.,7930 Jones Branch Drive,Suite 1100,Hotels,"Hilton Worldwide Holdings, Inc. engages in the provision of hospitality businesses. It operates through the following segments: Ownership and Management & Franchise. The Ownership segment includes owned, leased, and joint venture hotels. The Management and Franchise segment operates hotels of third-party owners. The company was founded by Conrad Hilton in 1925 and is headquartered in McLean, VA."
HOLX,Hologic Inc.,250 Campus Drive,"Marlborough, Massachusetts 01752",Medical Equipment/Supplies,"Hologic, Inc. engages in the development, manufacture, and supply of diagnostics products, medical imaging systems, and surgical products dedicated to serve the healthcare needs of women. It operates through the following segments: Breast Health, Diagnostics, GYN Surgical, and Skeletal Health. The Breast Health segment is involved in a portfolio of solutions for breast cancer care for radiology, pathology, and surgery. The Diagnostics segment focuses on products used to aid in the screening and diagnosis of human diseases. The GYN Surgical segment offers the NovaSure Endometrial Ablation System, the MyoSure Hysteroscopic Tissue Removal System, and the Fluent Fluid Management System. The Skeletal Health segment covers the Horizon DXA and the Fluoroscan Insight FD mini C-arm. The company was founded by S. David Ellenbogen and Jay A. Stein in 1985 and is headquartered in Marlborough, MA."
HD,Home Depot Inc.,2455 Paces Ferry Road,"Atlanta, Georgia 30339-4024",Home Goods Retail,"The Home Depot, Inc. engages in the sale of building materials and home improvement products. Its products include building materials, home improvement products, lawn and garden products and decor products. The firm operates through the following geographical segments: U.S., Canada and Mexico. It offers home improvement installation services, and tool and equipment rental. The company was founded by Bernard Marcus, Arthur M. Blank, Kenneth Gerald Langone and Pat Farrah on June 29, 1978, and is headquartered at Atlanta, GA."
HON,Honeywell International Inc.,855 South Mini Street,"Charlotte, North Carolina 28202",Diversified Holding Companies,"Honeywell International, Inc. is a software industrial company, which offers industry specific solutions to aerospace and automotive products and services. It specializes in turbochargers control, sensing and security technologies for buildings and homes, specialty chemicals, electronic and advanced materials, process technology for refining and petrochemicals, and energy efficient products and solutions for homes, business, and transportation. It operates through the following segments: Aerospace, Home and Building Technologies, Performance Materials and Technologies, and Safety and Productivity Solutions. The company was founded by Albert M. Butz in 1906 and is headquartered in Charlotte, NC."
HRL,Hormel Foods Corp.,1 Hormel Place,"Austin, Minnesota 55912-3680",Food Products,"Hormel Foods Corp. engages in the manufacturing and marketing of branded food products. It operates through the following segments: Retail, Foodservice, and International. The Retail segment consists of the processing, marketing, and sale of food products sold predominantly in the retail market. The Foodservice segment includes the processing, marketing, and sale of food and nutritional products for foodservice, convenience store, and commercial customers. The International segment focuses on processing, marketing, and selling company products internationally. The company was founded by George A. Hormel in 1891 and is headquartered in Austin, MN."
HST,Host Hotels & Resorts Inc.,4747 Bethesda Avenue,Suite 1300,Hotel/Lodging REITs,"Host Hotels & Resorts, Inc. is a real estate investment trust, which engages in the management of luxury and upper-upscale hotels. It operates through the following geographical segments: United States, Brazil and Canada. The company was founded in 1927 and is headquartered in Bethesda, MD."
HWM,Howmet Aerospace Inc.,201 Isabella Street,Suite 200,Aerospace Products/Parts,"Howmet Aerospace, Inc. engages in provision of engineered solutions for the aerospace and transportation industries. It operates through the following segments: Engine Products, Fastening Systems, Engineered Structures, and Forged Wheels. The Engine Products segment produces investment castings, including airfoils, and seamless rolled rings primarily for aircraft engines (aerospace commercial and defense) and industrial gas turbines. The Fastening Systems segment is involved in the production of aerospace fastening systems, as well as commercial transportation fasteners. The Engineered Structures segment includes titanium ingots and mill products for aerospace and defense applications and is vertically integrated to produce titanium forgings, extrusions forming and machining services for airframe, wing, aero-engine, and landing gear components. The Forged Wheels segment provides forged aluminum wheels and related products for heavy-duty trucks, trailers, and buses globally. The company was founded in 1888 and is headquartered in Pittsburgh, PA."
HPQ,HP Inc.,1501 Page Mill Road,"Palo Alto, California 94304-1112",Computers/Consumer Electronics,"HP, Inc. engages in the provision of personal computing and other access devices, imaging and printing products, and related technologies, solutions, and services. It operates through the following business segments: Personal Systems, Printing, and Corporate Investments. The Personal Systems segment offers commercial and consumer desktop and notebook personal computers, workstations, thin clients, commercial tablets and mobility devices, retail point-of-sale systems, displays and other related accessories, software, support, and services for the commercial and consumer markets. The Printing segment provides consumer and commercial printer hardware, supplies, solutions and services, and scanning devices. The Corporate Investments segment includes HP Labs and certain business incubation projects. The company was founded by William R. Hewlett and David Packard in 1939 and is headquartered in Palo Alto, CA."
HUM,Humana Inc.,500 West Main Street,"Louisville, Kentucky 40202",Life Insurance,"Humana Inc. engages in the provision of health insurance services. It operates through the Insurance and CenterWell segments. The Insurance segment consists of Medicare benefits, marketed to individuals or directly via group Medicare accounts, as well as contract with CMS to administer the Limited Income Newly Eligible Transition, or LI-NET, prescription drug plan program and contracts with various states to provide Medicaid, dual eligible demonstration, and Long-Term Support Services benefits, which refer to as state-based contracts. The CenterWell segment represents payor-agnostic healthcare services offerings, including pharmacy dispensing services, provider services, and home services. The company was founded by David A. Jones, Sr., and Wendell Cherry on August 18, 1961 and is headquartered in Louisville, KY."
HBAN,Huntington Bancshares Inc.,Huntington Center,41 South High Street,Banking,"Huntington Bancshares, Inc. operates as a bank holding company. It provides commercial and consumer banking services, mortgage banking services, automobile financing, recreational vehicle and marine financing, equipment leasing, investment management, trust services, brokerage services, insurance programs, other financial products and services. The firm operates through the following segments: Consumer & Business Banking, Commercial Banking, Commercial Real Estate & Vehicle Finance, Regional Banking & The Huntington Private Client Group, and Home Lending. The Consumer & Business Banking segment provides financial products and services to consumer and small business customers including but not limited to checking accounts, savings accounts, money market accounts, certificates of deposit, investments, consumer loans, credit cards and small business loans. The Commercial Banking segment provides products and services to the middle market, large corporate, and government public sector customers located primarily within its geographic footprint. The segment is divided into following business units: Middle Market, Large Corporate, Specialty Banking, Asset Finance, Capital Markets, Treasury Management, and Insurance. The Commercial Real Estate & Vehicle Finance segment provides products and services include providing financing for land, buildings, and other commercial real estate owned or constructed by real estate developers, automobile dealerships, or other customers with real estate project financing needs, and financing for the purchase of automobiles, light-duty trucks, recreational vehicles and marine craft at franchised dealerships, financing the acquisition of new and used vehicle inventory of franchised automotive dealerships. The Regional Banking and The Huntington Private Client Group segment consists of private banking, wealth & investment management, and retirement plan services. The Home Lending segment originates and services consumer loans and mortgages for customers who are located in primary banking markets. The company was founded in 1866 and is headquartered in Columbus, OH."
HII,Huntington Ingalls Industries Inc.,4101 Washington Avenue,"Newport News, Virginia 23607",Defense Equipment/Products,"Huntington Ingalls Industries, Inc. engages in the shipbuilding business. It operates through the following business segments: Ingalls, Newport News, and Mission Technologies. The Ingalls segment designs and constructs non-nuclear ships, including amphibious assault ships, expeditionary warfare ships, surface combatants, and national security cutters (NSC). The Newport News segment designs and builds nuclear-powered aircraft carriers and submarines, and the refueling and overhaul and the inactivation of nuclear-powered aircraft carriers. The Mission Technologies segment includes business groups focused on high-end information technology (IT) and mission-based solutions for DoD, intelligence, and federal civilian customers, life-cycle sustainment services to the U.S. Navy fleet and other maritime customers, unmanned, autonomous systems, and nuclear management and operations and environmental management services for the Department of Energy (DoE), DoD, state and local governments, and private sector companies. The company was founded on August 4, 2010, and is headquartered in Newport News, VA."
IBM,International Business Machines Corp.,1 New Orchard Road,"Armonk, New York 10504-1722",Computer Services,"International Business Machines Corp. is an information technology company, which engages in the provision of integrated solutions that leverage information technology and knowledge of business processes. It operates through the following segments: Software, Consulting, Infrastructure, Financing, and Other. The Software segment combines hybrid cloud platform and software solutions to help clients become more data-driven, and to automate, secure, and modernize their environments. The Consulting segment focuses on integrating skills on strategy, experience, technology and operations by domain and industry. The Infrastructure segment offers solutions for hybrid cloud, and is the foundation of the hybrid cloud stack. Infrastructure is optimized for infusing AI into mission-critical transactions and tightly integrated with IBM Software including Red Hat for accelerated hybrid cloud benefits. The Financing segment refers to the client and commercial financing, facilitating IBM clients’ acquisition of IT systems, software, and services. The company was founded by Charles Ranlett Flint and Thomas J. Watson Sr. on June 16, 1911 and is headquartered in Armonk, NY."
IEX,IDEX Corp.,3100 Sanders Road,Suite 301,Industrial Machinery,"IDEX Corp. engages in the provision of engineering solutions. It operates through the following segments: Fluid and Metering Technologies, Health and Science Technologies, and Fire and Safety or Diversified Products. The Fluid and Metering Technologies segment is involved in the design, production, and distribution of displacement pumps, valves, flow meters, injectors, and fluid-handling pump modules and systems. The Health and Science Technologies segment includes design, production, and distribution of precision fluidics, rotary lobe pumps, centrifugal and positive displacement pumps, roll compaction, and drying systems used in beverage, food processing, pharmaceutical, and cosmetics, pneumatic components, and sealing solutions. The Fire and Safety or Diversified Products segment consists of the production of firefighting pumps and controls, apparatus valves, monitors, nozzles, rescue tools, and lifting bags for the fire and rescue industry. The company was founded on September 24, 1987, and is headquartered in Northbrook, IL."
IDXX,IDEXX Laboratories Inc.,One IDEXX Drive,"Westbrook, Maine 04092-2040",Medical Equipment/Supplies,"IDEXX Laboratories, Inc. engages in the development, manufacture, and distribution of products and services for the animal veterinary, livestock and poultry, dairy, and water testing markets. It operates through the following segments: Companion Animal Group (CAG), Water Quality Products (Water), Livestock, Poultry, and Dairy (LPD), and Other. The CAG segment provides diagnostic and information management-based products and services for the companion animal veterinary industry, including in-clinic diagnostic solutions, outside reference laboratory services, and veterinary software and services. The Water segment offers innovative testing solutions for easy, rapid, and accurate detection and quantification of various microbiological parameters in water. The LPD segment develops diagnostic tests, services, and related instrumentation that are used to manage the health status of livestock and poultry, to improve producer efficiency, and to ensure the quality and safety of milk and food. The Other segment is composed of products for the human point-of-care medical diagnostics market with its out-licensing arrangements. The company was founded by David Evans Shaw on December 19, 1983, and is headquartered in Westbrook, ME."
ITW,Illinois Tool Works Inc.,155 Harlem Avenue,"Glenview, Illinois 60025",Diversified Holding Companies,"Illinois Tool Works, Inc. engages in the manufacture of industrial products and equipment. It operates through the following segments: Automotive OEM, Test and Measurement and Electronics, Food Equipment, Polymers and Fluids, Welding, Construction Products, and Specialty Products. The Automotive OEM segment produces components and fasteners for automotive-related applications. The Test and Measurement and Electronics segment manufactures equipment, consumables, and related software for testing and measuring of materials, structures, gases and fluids. The Food Equipment segment supplies commercial food equipment and provides related services. The Polymers and Fluids segment provides adhesives, sealants, lubrication and cutting fluids, janitorial and hygiene products, and fluids and polymers for auto aftermarket maintenance and appearance. The Welding segment furnishes arc welding equipment, consumables and accessories for a wide array of industrial and commercial applications. The Construction Products segment makes construction fastening systems and truss products. The Specialty Products segment manufactures beverage packaging equipment and consumables, product coding and marking equipment and consumables, and appliance components and fasteners. The company was founded by Byron L. Smith in 1912 and is headquartered in Glenview, IL."
ILMN,Illumina Inc.,5200 Illumina Way,"San Diego, California 92122",Biotechnology,"Illumina, Inc. engages in the development, manufacturing, and marketing of life science tools and integrated systems for large-scale analysis of genetic variation and function. It operates through the Core Illumina segment, which serves customers in the research, clinical and applied markets fields, and enables the adoption of a variety of genomic solutions. The firm's products include instruments, kits and reagents, selection tools, and software and analysis. Its services include sequencing and microarray services, proactive instrument monitoring, and instrument services, training, and consulting. The company was founded by David R. Walt, John R. Stuelpnagel, Anthony W. Czarnik, Lawrence A. Bock, and Mark S. Chee in April 1998 and is headquartered in San Diego, CA."
INCY,Incyte Corp.,1801 Augustine Cut-Off,"Wilmington, Delaware 19803",Biotechnology,"Incyte Corp. is a biopharmaceutical company, which engages in the discovery, development, and commercialization of proprietary therapeutics. The company was founded in April 1991 and is headquartered in Wilmington, DE."
IR,Ingersoll Rand Inc.,525 Harbor Place Drive,Suite 600,Industrial Machinery,"Ingersoll Rand Inc. provides technology-driven flow creation and industrial solutions across 40+ respected brands. It operates through two segments: Industrial Technologies and Services & Precision and Science Technologies. The Industrial Technologies and Services segment has a broad Range of Compressor, Vacuum and Blower Solutions as well as Industrial Technologies Including Power Tools and Lifting Equipment. The Precision and Science Technologies segment is Highly Specialized Fluid Management Solutions Including Precision Liquid and Gas Pumps and Niche Compression Technologies. The company was founded in 1872 and is headquartered in Davidson, NC."
PODD,Insulet Corp.,100 Nagog Park,"Acton, Massachusetts 01720",Medical Equipment/Supplies,"Insulet Corp. is a medical device company, which engages in the development, manufacture, and marketing of an insulin infusion system for people with insulin-dependent diabetes. It specializes in diabetes supplies, including the OmniPod System, as well as other diabetes related products and supplies such as blood glucose testing supplies, traditional insulin pumps, pump supplies, and pharmaceuticals. The company was founded by John L. Brooks III and John T. Garibotto in July 2000 and is headquartered in Acton, MA."
INTC,Intel Corp.,2200 Mission College Boulevard,"Santa Clara, California 95054-1549",Semiconductors,"Intel Corp. engages in the design, manufacture, and sale of computer products and technologies. It delivers computer, networking, data storage, and communications platforms. The firm operates through the following segments: Client Computing Group (CCG), Data Center and AI (DCAI), Network and Edge (NEX), Mobileye, Accelerated Computing Systems and Graphics (AXG), Intel Foundry Services (IFS), and All Other. The CCG segment consists of platforms designed for notebooks, 2-in-1 systems, desktops, tablets, phones, wireless and wired connectivity products, and mobile communication components. The DCAI segment delivers solutions to cloud service providers and enterprise customers, along with silicon devices for communications service providers and high-performance computing customers. The NEX segment offers computing system solutions from inflexible fixed-function hardware to general-purpose compute, acceleration, and networking devices running cloud native software on programmable hardware. The Mobileye segment develops driving assistance and self-driving solutions. The AXG segment provides products and technologies designed to help customers solve the toughest computational problems. Its products include CPUs for high-performance computing and GPUs targeted for a range of workloads and platforms, from gaming and content creation on client devices to delivering media and gaming in the cloud, and the most demanding high-performance computing and AI workloads on supercomputers. The IFS segment refers to full stack solutions created from the foundry industry ecosystem. The All Other segment represents results from other non-reportable segments and corporate-related charges. The company was founded by Robert Norton Noyce and Gordon Earle Moore on July 18, 1968, and is headquartered in Santa Clara, CA."
ICE,Intercontinental Exchange Inc.,5660 New Northside Drive,"Atlanta, Georgia 30328",Securities,"Intercontinental Exchange, Inc. engages in the provision of market infrastructure, data services and technology solutions. It operates through the following segments: Exchanges, Fixed Income and Data Services, and Mortgage Technology. The Exchanges segment includes trading and listing revenue from the global futures network, the New York Stock Exchange and other registered securities exchanges. The Fixed Income and Data Services segment is composed of fixed income data and analytics offerings, fixed income execution, credit default swap clearing and other multi-asset class data and network services. The Mortgage Technology segment provides an end-to-end network aimed at identifying and solving the inefficiencies that exist in the U.S. residential mortgage market. The company was founded by Jeffrey C. Sprecher in May 2000 and is headquartered in Atlanta, GA."
