symbol,name,address1,address2,industry,summary
MMM,3M Co.,3M Center,"St. Paul, Minnesota 55144-1000",Diversified Holding Companies,"3M Co. is a technology company, which manufactures industrial, safety, and consumer products. It operates through the following segments: Safety and Industrial, Transportation and Electronics, Health Care, Consumer, and Corporate and Unallocated. The Safety and Industrial segment consists of personal safety, industrial adhesives and tapes, abrasives, closure and masking systems, electrical markets, automotive aftermarket, and roofing granules. The Transportation and Electronics segment includes electronics, automotive and aerospace, commercial solutions, advanced materials, and transportation safety. The Health Care segment offers medical and surgical supplies, skin health and infection prevention products, oral care solutions, separation and purification sciences, health information systems, inhalation and transdermal drug delivery systems, and food safety products. The Consumer segment covers consumer healthcare, home care, home improvement, and stationery and office products, such as consumer bandages, braces, supports, respirators, cleaning products, retail abrasives, picture hanging, and consumer air quality solutions. The Corporate and Unallocated segment refers to special items and other corporate expense-net. The company was founded by Henry S. Bryan, Hermon W. Cable, John Dwan, William A. McGonagle, and J. Danley Budd in 1902 and is headquartered in St. Paul, MN."
AOS,A.O. Smith Corp.,11270 West Park Place,Suite 170,Building Materials/Products,"A. O. Smith Corp. manufactures residential and commercial gas and electric water heaters, boilers, tanks, and water treatment products. It operates through the North America and Rest of World segments. The North America segment manufactures and markets comprehensive lines of residential and commercial gas and electric water heaters, boilers, and tanks. The Rest of World segment markets water treatment products in China, Europe, and India. The company was founded by Charles Jeremiah Smith in 1874 and is headquartered in Milwaukee, WI."
ABT,Abbott Laboratories,100 Abbott Park Road,"Abbott Park, Illinois 60064-6400",Pharmaceuticals,"Abbott Laboratories engages in the discovery, development, manufacture, and sale of a broad and diversified line of health care products. It operates through the following business segments: Established Pharmaceutical Products, Diagnostic Products, Nutritional Products, and Medical Devices. The Established Pharmaceutical Products segment refers to the international sales of a line of branded generic pharmaceutical products. The Diagnostic Products segment markets diagnostic systems and tests for blood banks, hospitals, commercial laboratories, and alternate-care testing sites. The Nutritional Products segment caters to the worldwide sales of adult and pediatric nutritional products. The Medical Devices segment includes electrophysiology, heart failure, vascular and structural heart devices for the treatment of cardiovascular diseases, and diabetes care products for people with diabetes, as well as neuromodulation devices for the management of chronic pain and movement disorders. The company was founded by Wallace Calvin Abbott in 1888 and is headquartered in Abbott Park, IL."
ABBV,AbbVie Inc.,1 North Waukegan Road,"North Chicago, Illinois 60064-6400",Biotechnology,"AbbVie, Inc. is a research-based biopharmaceutical company, which engages in the development and sale of pharmaceutical products. It focuses on treating conditions such as chronic autoimmune diseases in rheumatology, gastroenterology, and dermatology, oncology, including blood cancers, virology, hepatitis C virus (HCV) and human immunodeficiency virus (HIV), neurological disorders, such as Parkinson's, metabolic, comprising thyroid disease and complications associated with cystic fibrosis, pain associated with endometriosis, and other serious health conditions. The company was founded on October 19, 2011 and is headquartered in North Chicago, IL."
ACN,Accenture PLC Cl A,1 Grand Canal Square,Grand Canal Harbour,Diversified Business Services,"Accenture Plc engages in the provision of management consulting, technology, and outsourcing services. It operates through the following geographical segments: North America, Europe and Growth Markets. The company was founded in 1989 and is headquartered in Dublin, Ireland."
ADM,Archer Daniels Midland Co.,77 West Wacker Drive,Suite 4600,Food Products,"Archer-Daniels-Midland Co. engages in the production of oilseeds, corn, wheat, cocoa, and other agricultural commodities. It operates through the following segments: Ag Services and Oilseeds, Carbohydrate Solutions, Nutrition, and Other. The Ag Services and Oilseeds segment includes activities related to the origination, merchandising, transportation, and storage of agricultural raw materials, and the crushing and further processing of oilseeds such as soybeans and soft seeds cottonseed, sunflower seed, canola, rapeseed, and flaxseed into vegetable oils and protein meals. The Carbohydrate Solutions segment consists of corn and wheat wet and dry milling and other activities. The Nutrition segment serves various end markets including food, beverages, nutritional supplements, and feed and premix for livestock, aquaculture, and pet food. The Other segment refers to the company’s remaining operations. The company founded in 1902 and is headquartered in Chicago, IL."
ADBE,Adobe Inc.,345 Park Avenue,"San Jose, California 95110-2704",Software,"Adobe, Inc. engages in the provision of digital marketing and media solutions. It operates through the following segments: Digital Media, Digital Experience, and Publishing and Advertising. The Digital Media segment offers creative cloud services, which allow members to download and install the latest versions of products, such as Adobe Photoshop, Adobe Illustrator, Adobe Premiere Pro, Adobe Photoshop Lightroom and Adobe InDesign, as well as utilize other tools, such as Adobe Acrobat. The Digital Experience segment provides solutions, including analytics, social marketing, targeting, media optimization, digital experience management, and cross-channel campaign management, as well as premium video delivery and monetization. The Publishing and Advertising segment includes legacy products and services for eLearning solutions, technical document publishing, web application development, and high-end printing. The company was founded by Charles M. Geschke and John E. Warnock in December 1982 and is headquartered in San Jose, CA."
ADP,Automatic Data Processing Inc.,1 ADP Boulevard,"Roseland, New Jersey 07068-1728",Diversified Business Services,"Automatic Data Processing, Inc. engages in the provision of business outsourcing solutions in cloud-based human capital management. It operates through the following business segments: Employer Services, Professional Employer Organization Services, and Other. The Employer Services segment provides clients from single-employee small businesses to large enterprises offering human resources outsourcing and technology-based human capital management solutions and cloud-based platforms. The Professional Employer Organization Services segment offers small and mid-sized businesses a human resource outsourcing solution through a co-employment mode. The Other segment includes the certain corporate overhead charges and expenses that have not been allocated to the reportable segments. The company was founded by Henry Taub in 1949 and is headquartered in Roseland, NJ."
AES,AES Corp.,4300 Wilson Boulevard,11th floor,Electric Utilities,"The AES Corp. engages in the provision of power generation and utility services through its renewable and thermal generation facilities and distribution businesses. It operates through the following segments: U.S. and Utilities Strategic Business Unit (SBU), South America SBU, MCAC SBU, Eurasia SBU. The U.S. and Utilities SBU segment consists of facilities in the United States, Puerto Rico and El Salvador. The South America SBU segment covers Chile, Colombia, Argentina, and Brazil. The MCAC SBU segment refers to Mexico, Central America, and the Caribbean. The Eurasia SBU segment handles operations in Europe and Asia. The company was founded by Dennis W. Bakke and Roger W. Sant in 1981 and is headquartered in Arlington, VA."
AFL,AFLAC Inc.,1932 Wynnton Road,"Columbus, Georgia 31999",Life Insurance,"Aflac, Inc. is a holding company, which engages in the provision of financial protection services. It operates through the following segments: Aflac Japan and Aflac U.S. The Aflac Japan segment offers life insurance, death benefits, and cash surrender values. The Aflac U.S. segment sells voluntary supplemental insurance products for people who already have major medical or primary insurance coverage. The company was founded by John Amos, Paul Amos and William Amos on November 17, 1955 and is headquartered in Columbus, GA."
A,Agilent Technologies Inc.,5301 Stevens Creek Boulevard,"Santa Clara, California 95051",Medical Equipment/Supplies,"Agilent Technologies, Inc. engages in the provision of application focused solutions for life sciences, diagnostics, and applied chemical markets. It operates through the following segments: Life Sciences and Applied Markets, Diagnostics and Genomics, and Agilent CrossLab. The Life Sciences and Applied Markets segment offers application-focused solutions that include instruments and software that identify, quantify, and analyze the physical and biological properties of substances and products, as well as the clinical and life sciences research areas to interrogate samples at the molecular and cellular level. The Diagnostics and Genomics segment consists of activity providing active pharmaceutical ingredients for oligo-based therapeutics, as well as solutions that include reagents, instruments, software and consumables. The Agilent CrossLab segment includes startup, operational, training and compliance support, software as a service, and asset management and consultative services. The company was founded in May 1999 and is headquartered in Santa Clara, CA."
ABNB,Airbnb Inc. Cl A,888 Brannan Street,"San Francisco, California 94103",Hotels,"Airbnb, Inc. engages in the management and operation of an online marketplace. Its marketplace model connects hosts and guests online or through mobile devices to book spaces. The company was founded by Brian Chesky, Nathan Blecharczyk and Joseph Gebbia in 2007 and is headquartered in San Francisco, CA."
APD,Air Products & Chemicals Inc.,1940 Air Products Boulevard,"Allentown, Pennsylvania 18106-5500",Chemicals,"Air Products & Chemicals, Inc. engages in the manufacture and distribution of atmospheric gases. It operates through the following segments: Industrial Gases-Americas, Industrial Gases-EMEA (Europe, Middle East, and Africa), Industrial Gases-Asia, Industrial Gases-Global, and Corporate & Other. The Industrial Gases-America, EMEA, and Asia segment markets and produces atmospheric gases, such as oxygen, nitrogen, argon, and rare gases, process gases, such as hydrogen, helium, carbon dioxide, carbon monoxide, syngas, and specialty gases and equipment for the production and processing of gases, such as air separation units and non-cryogenic generators. The Industrial Gases-Global segment comprises cryogenic and gas processing equipment for air separation. The Corporate & Other segment includes LNG equipment and helium storage and distribution sale of equipment businesses and corporate support functions. The company was founded by Leonard Parker Pool on September 30, 1940 and is headquartered in Allentown, PA."
AKAM,Akamai Technologies Inc.,145 Broadway,"Cambridge, Massachusetts 02142-1413",Internet/Online,"Akamai Technologies, Inc. engages in the provision of cloud services for delivering, optimizing, and securing content and business applications over the Internet. Its products include security, web performance, media delivery, and network operator. The company was founded by Frank T. Leighton, Jonathan Seelig, Randall S. Kaplan, and Daniel M. Lewin on August 20, 1998 and is headquartered in Cambridge, MA."
ALK,Alaska Air Group Inc.,19300 International Boulevard,"Seattle, Washington 98188-5304",Passenger Airlines,"Alaska Air Group, Inc. is a holding company, which engages in the provision of air transportation services. It operates through the following segments: Mainline, Regional, and Horizon. The Mainline segment includes scheduled air transportation on Alaska's Boeing and Airbus jet aircraft for passengers and cargo throughout the U.S., and in parts of Mexico, Costa Rica and Belize. The Regional segment consists of Horizon's and other third-party carriers’ scheduled air transportation for passengers across a shorter distance network within the U.S. and Canada under capacity purchase agreements (CPA). The Horizon segment encompasses the capacity sold to Alaska under a CPA. The company was founded in 1985 and is headquartered in Seattle, WA."
ALB,Albemarle Corp.,4250 Congress Street,Suite 900,Chemicals,"Albemarle Corp. engages in the development, manufacture, and marketing of chemicals for consumer electronics, petroleum refining, utilities, packaging, construction, transportation, pharmaceuticals, crop production, food-safety, and custom chemistry services. It operates through the following business segments: Lithium, Bromine, Catalysts, and All Other. The Lithium segment develops and manufactures basic lithium compounds, including lithium carbonate, lithium hydroxide, lithium chloride, and value-added lithium specialties and reagents. The Bromine segment consists of bromine and bromine-based businesses including products used in fire safety solutions and other specialty chemicals applications. The Catalysts segment contains two product lines: clean fuel technologies, which are primarily composed of hydro processing catalysts, and heavy oil upgrading that is composed of fluidized catalytic cracking catalysts and additives. The All Other segment includes the FCS business. The company was founded in 1993 and is headquartered in Charlotte, NC."
ARE,Alexandria Real Estate Equities Inc.,26 North Euclid Avenue,"Pasadena, California 91101",Healthcare REITs,"Alexandria Real Estate Equities, Inc. engages in the business of providing space for lease. The firm is also an owner, operator, and developer of life science, agrotechnology, and technology campuses in Greater Boston, the San Francisco Bay Area, New York City, San Diego, Seattle, Maryland, and Research Triangle. The company was founded by Alan D. Gold, Gary A. Kreitzer, Joel S. Marcus, and Jerry M. Sudarsky in October 1994 and is headquartered in Pasadena, CA."
ALGN,Align Technology Inc.,410 North Scottsdale Road,Suite 1300,Medical Equipment/Supplies,"Align Technology, Inc. engages in the design, manufacture, and market of orthodontics, restorative, and aesthetic dentistry products. It operates through the Clear Aligner, and Scanner and Services segments. The Clear Aligner segment consists of Invisalign full, teen, and assist products, and Vivera retainers for treating malocclusion. The Scanner and Services segment consists of intraoral scanning systems such as single hardware platforms and restorative or orthodontic software options, ancillary products, and other related additional services. The company was founded by Zia Chishti, Brian Freyburger, and Kelsey Wirth in March 1997 and is headquartered in Tempe, AZ."
ALLE,Allegion PLC,Iveagh Court,Harcourt Road,General Services,"Allegion Plc engages in the provision of security products and solutions that keep people safe, secure, and productive. It operates through the Allegion Americas and Allegion International segments. Its brands include CISA, Interflex, LCN, Schlage, SimonsVoss, and Von Duprin. The company was founded on May 9, 2013 and is headquartered in Dublin, Ireland."
LNT,Alliant Energy Corp.,4902 North Biltmore Lane,Suite 1000,Electric Utilities,"Alliant Energy Corp. is a regulated investor-owned public utility holding company, which engages in the provision of regulated electricity and natural gas service to natural gas customers in the Midwest through its two public utility subsidiaries. It operates through following segments: Electric Utility, Gas Utility, Other Utility, and Non-Utility and Other. The company was founded in 1981 and is headquartered in Madison, WI."
ALL,Allstate Corp.,3100 Sanders Road,"Northbrook, Illinois 60062",Non-Life Insurance,"The Allstate Corp. engages in the property and casualty insurance business and the provision of protection solutions. It operates through following business segments: Allstate Protection, Protection Services, Allstate Health and Benefits, Run-off Property-Liability, and Corporate and Other. The Allstate Protection segment offers private passenger auto, homeowners, other personal lines, and commercial insurance marketed under the Allstate, National General, and Answer Financial brand names. The Protection Services segment provides a range of products and services that expand and enhance customer value propositions including Allstate Protection Plans, Allstate Dealer Services, Allstate Roadside, Arity, and Allstate Identity Protection. The Allstate Health and Benefits segment offers voluntary benefits and individual life and health products, including life, accident, critical illness, short term disability, and other health insurance products sold through independent agents, benefit brokers, and Allstate exclusive agencies. The Run-off Property-Liability segment relates to property and casualty insurance policies with exposure to asbestos, environmental, and other claims. The Corporate and Other segment includes the company's holding activities and certain non-insurance operations. The company was founded on April 17, 1931 and is headquartered in Northbrook, IL."
GOOGL,Alphabet Inc. Cl A,1600 Amphitheatre Parkway,"Mountain View, California 94043",Internet/Online,"Alphabet, Inc. engages in the business of delivering online advertising, cloud-based solutions that provide enterprise customers with infrastructure and platform services, the provision of communication and collaboration tools, and sales of other products and services such as apps and in-app purchases, hardware, and subscription-based products. It operates under the Google Services and Google Cloud segments. The Google Services segment includes ads, Android, Chrome, hardware, Gmail, Google Drive, Google Maps, Google Photos, Google Play, Search, and YouTube. The Google Cloud segment offers Google Cloud Platform and Google Workspace. The company was founded by Lawrence E. Page and Sergey Mikhaylovich Brin on October 2, 2015 and is headquartered in Mountain View, CA."
GOOG,Alphabet Inc. Cl C,1600 Amphitheatre Parkway,"Mountain View, California 94043",Internet/Online,"Alphabet, Inc. engages in the business of delivering online advertising, cloud-based solutions that provide enterprise customers with infrastructure and platform services, the provision of communication and collaboration tools, and sales of other products and services such as apps and in-app purchases, hardware, and subscription-based products. It operates under the Google Services and Google Cloud segments. The Google Services segment includes ads, Android, Chrome, hardware, Gmail, Google Drive, Google Maps, Google Photos, Google Play, Search, and YouTube. The Google Cloud segment offers Google Cloud Platform and Google Workspace. The company was founded by Lawrence E. Page and Sergey Mikhaylovich Brin on October 2, 2015 and is headquartered in Mountain View, CA."
MO,Altria Group Inc.,6601 West Broad Street,"Richmond, Virginia 23230",Tobacco,"Altria Group, Inc. operates as a holding company, which engages in the manufacture and sale of cigarettes in the United States. It operates through the following segments: Smokeable Products, Oral tobacco products, and Wine. The Smokeable Products segment consists of cigarettes manufactured and sold by PM USA and machine-made large cigars and pipe tobacco manufactured and sold by Middleton. The Oral tobacco products segment is primarily moist smokeless tobacco products (MSTs) through brands like Copenhagen and Skoal as well as on! oral nicotine pouches sold by Helix. The Wine segment, through subsidiary Ste. Michelle Wine Estates Ltd, produces Washington State wines, primarily Chateau Ste. Michelle and 14 Hands, and owns wineries in or distributes wines from several other wine regions. The company was founded in 1919 and is headquartered in Richmond, VA."
AMZN,Amazon.com Inc.,410 Terry Avenue North,"Seattle, Washington 98109-5210",Mixed Retailing,"Amazon.com, Inc. is a multinational technology company, which engages in the provision of online retail shopping services. It operates through the following segments: North America, International, and Amazon Web Services (AWS). The North America segment is involved in the retail sales of consumer products including from sellers and subscriptions through North America-focused online and physical stores. It also includes export sales from online stores. The International segment focuses on the amounts earned from retail sales of consumer products including from sellers and subscriptions through internationally-focused online stores. The AWS segment consists of global sales of compute, storage, database, and other services for start-ups, enterprises, government agencies, and academic institutions. The company was founded by Jeffrey P. Bezos in July 1994 and is headquartered in Seattle, WA."
AMD,Advanced Micro Devices Inc.,2485 Augustine Drive,"Santa Clara, California 95054",Semiconductors,"Advanced Micro Devices, Inc. engages in the provision of semiconductor businesses. It operates through the following segments: Computing & Graphics, and Enterprise, Embedded and Semi-Custom. The Computing and Graphics segment includes desktop and notebook processors and chipsets, discrete and integrated graphics processing units, data center and professional GPUs and development services. The Enterprise, Embedded and Semi-Custom segment includes server and embedded processors, semi-custom System-on-Chip products, development services and technology for game consoles. The company was founded by W. J. Sanders III on May 1, 1969 and is headquartered in Santa Clara, CA."
AEE,Ameren Corp.,One Ameren Plaza,1901 Chouteau Avenue,Electric Utilities,"Ameren Corp. is a public utility holding company, which engages in the provision of electric and natural gas services. It operates through the following segments: Ameren Missouri, Ameren Illinois Electric Distribution, Ameren Illinois Natural Gas, Ameren Transmission, and Other. The Ameren Transmission segment consists of the aggregated electric transmission businesses of Ameren Illinois and Ameren Transmission Company of Illinois (ATXI). The company was founded in 1902 and is headquartered in St. Louis, MO."
AAL,American Airlines Group Inc.,1 Skyview Drive,"Fort Worth, Texas 76155",Passenger Airlines,"American Airlines Group, Inc. is a holding company, which engages in the operation of a network carrier through its principal wholly-owned mainline operating subsidiary, American. The firm offers air transportation for passengers and cargo. It operates through the following geographical segments: Department of Transportation Domestic, Department of Transportation Latin America, Department of Transportation Atlantic, and Department of Transportation Pacific. The company was founded on December 9, 2013 and is headquartered in Fort Worth, TX."
AEP,American Electric Power Co. Inc.,1 Riverside Plaza,"Columbus, Ohio 43215-2373",Electric Utilities,"American Electric Power Co., Inc. engages in the generation, transmission, and distribution of electricity. It operates through the following segments: Vertically Integrated Utilities, Transmission and Distribution Utilities, AEP Transmission Holdco, and Generation and Marketing. The Vertically Integrated Utilities segment covers the generation, transmission, and distribution of electricity for sale to retail and wholesale customers. The Transmission and Distribution Utilities segment represents the transmission and distribution of electricity for sale to retail and wholesale customers. The AEP Transmission Holdco segment comprised of the development, construction, and operation of transmission facilities through investments in its wholly-owned transmission subsidiaries and joint ventures. The Generation and Marketing segment consists of the non-regulated generation and marketing, risk management, and retail activities. The company was founded on December 20, 1906 and is headquartered in Columbus, OH."
