symbol,name,address1,address2,industry,summary
PYPL,PayPal Holdings Inc.,2211 North First Street,"San Jose, California 95131",Consumer Finance,"PayPal Holdings, Inc. engages in the development of technology platforms for digital payments. Its solutions include PayPal, PayPal Credit, Braintree, Venmo, Xoom, and Paydiant products. It manages a two-sided proprietary global technology platform that links customers, which consist of both merchants and consumers, to facilitate the processing of payment transactions. It allows its customers to use their account for both purchase and paying for goods, as well as to transfer and withdraw funds. It also enables consumers to exchange funds with merchants using funding sources, which include bank account, PayPal account balance, PayPal Credit account, credit and debit card or other stored value products. It offers consumers person-to-person payment solutions through its PayPal Website and mobile application, Venmo and Xoom. The company was founded in December 1998 and is headquartered in San Jose, CA."
PNR,Pentair PLC,Regal House,70 London Road,Industrial Machinery,"Pentair plc engages in the provision of water solutions for residential, commercial, industrial, infrastructure, and agriculture applications. Its portfolio of solutions enables people, businesses, and industries to access clean, safe water, reduce water consumption, and recover and reuse it. The firm operates through the following business segments: Consumer Solutions and Industrial & Flow Technologies. The Consumer Solutions segment designs, manufactures and sells energy-efficient residential and commercial pool equipment and accessories, and commercial and residential water treatment products and systems. The Industrial & Flow Technologies segment manufactures and sells a variety of fluid treatment and pump products and systems, including pressure vessels, gas recovery solutions, membrane bioreactors, wastewater reuse systems and advanced membrane filtration, separation systems, water disposal pumps, water supply pumps, fluid transfer pumps, turbine pumps, solid handling pumps, and agricultural spray nozzles, while serving the global residential, commercial and industrial markets. The company was founded by Murray J. Harpole, Vern Stone, Vincent Follmer, Leroy Nelson, and Gary Ostrand on August 31, 1966, and is headquartered in London, the United Kingdom."
PEP,PepsiCo Inc.,700 Anderson Hill Road,"Purchase, New York 10577",Non-Alcoholic Beverages/Drinks,"PepsiCo, Inc. engages in the manufacture, marketing, distribution, and sale of beverages, food, and snacks. It operates through the following business segments: Frito-Lay North America (FLNA), Quaker Foods North America (QFNA), PepsiCo Beverages North America (PBNA), Latin America (LatAm), Europe, Africa, Middle East, and South Asia (AMESA), and Asia Pacific, Australia and New Zealand, and China Region (APAC). The FLNA segment consists of branded convenient food businesses in the United States and Canada. The QFNA segment includes cereals, rice, and pasta under the Quaker, Pearl Milling Company, Quaker Chewy, Cap'n Crunch, Life, and Rice-A-Roni brands. The PBNA segment is composed of beverage concentrates, fountain syrups, and finished goods under various beverage brands such as Pepsi, Gatorade, Mountain Dew, Diet Pepsi, Aquafina, Diet Mountain Dew, Sierra Mist, and Mug. The LatAm segment covers beverage, food, and snack businesses in the Latin American region. The Europe segment offers beverage, food, and snack goods in Europe and Sub-Saharan Africa regions. The AMESA segment deals with all beverage and convenient food businesses in Africa, the Middle East, and South Asia. The APAC segment refers to all business operations in the Asia Pacific, Australia and New Zealand, and China region. The company was founded by Donald M. Kendall, Sr. and Herman W. Lay in 1965 and is headquartered in Purchase, NY."
PFE,Pfizer Inc.,66 Hudson Boulevard East,"New York, New York 10001-2192",Pharmaceuticals,"Pfizer Inc. is a research-based global biopharmaceutical company. It engages in the discovery, development, manufacture, marketing, sales and distribution of biopharmaceutical products worldwide. The firm works across developed and emerging markets to advance wellness, prevention, treatments and cures that challenge the most feared diseases. The company was founded by Charles Pfizer Sr. and Charles Erhart in 1849 and is headquartered in New York, NY."
PCG,PG&E Corp.,300 Lakeside Drive,"Oakland, California 94612",Electric Utilities,"PG&E Corp. is a holding company, which engages in generation, transmission, and distribution of electricity and natural gas to customers. It specializes in energy, utility, power, gas, electricity, solar and sustainability. The company was founded in 1995 and is headquartered in Oakland, CA."
PM,Philip Morris International Inc.,677 Washington Boulevard,Suite 1100,Tobacco,"Philip Morris International, Inc. is a holding company, which engages in the manufacture and sale of cigarettes and smoke-free products, including heat-not-burn, e-vapor, and oral nicotine products. The company is working to deliver a smoke-free future and to evolve its portfolio for the long term to include products outside of the tobacco and nicotine sector. It develops scientifically substantiate and commercialize innovative smoke-free products for adults who would otherwise continue to smoke, with the goal of completely ending the sale of cigarettes. This includes pre-clinical systems toxicology, clinical and behavioral research, as well as post-market studies. It operates through the following segments: Europe Region, South and Southeast Asia, Commonwealth of Independent States, Middle East and Africa Region, East Asia, Australia, and PMI Duty Free Region, Americas Region, Swedish Match, and Wellness and Healthcare. The company was founded by Philip Morris in 1847 and is headquartered in Stamford, CT."
PSX,Phillips 66,2331 CityWest Boulevard,"Houston, Texas 77042",Pipeline Transportation,"Phillips 66 engages in the processing, transportation, storage, and marketing of fuels and other related products. The company operates through the following segments: Midstream, Chemicals, Refining and Marketing & Specialties. The Midstream segment provides crude oil and refined products transportation, terminaling and processing services, as well as natural gas, natural gas liquids and liquefied petroleum gas transportation, storage, processing and marketing services. The Chemicals segment produces and markets petrochemicals and plastics on a worldwide basis. The Refining segment Refines crude oil and other feedstocks into petroleum products such as gasoline, distillates and aviation fuels. The Marketing and Specialties segment purchases for resale and markets refined petroleum products such as base oils and lubricants, as well as power generation operations. The company was founded in 1875 and is headquartered in Houston, TX."
PNW,Pinnacle West Capital Corp.,400 North 5th Street,"Phoenix, Arizona 85004-3902",Electric Utilities,"Pinnacle West Capital Corp. is a holding company, which engages in providing energy and energy-related products. It offers regulated retail and wholesale electricity businesses and related activities, such as electricity generation, transmission and distribution through its subsidiary, Arizona Public Service Co. The company was founded on February 20, 1985, and is headquartered in Phoenix, AZ."
PXD,Pioneer Natural Resources Co.,777 Hidden Ridge,"Irving, Texas 75038",Upstream Oil & Gas,"Pioneer Natural Resources Co. operates as an independent oil and gas exploration and production company. The firm engages in hydrocarbon exploration in the Cline Shale. It focuses on the operation of the Permian Basin, Eagle Ford Shale, Rockies, and West Panhandle projects. The company was founded by Scott Douglas Sheffield on April 2, 1997, and is headquartered in Irving, TX."
PNC,PNC Financial Services Group Inc.,The Tower at PNC Plaza,300 5th Avenue,Banking,"The PNC Financial Services Group, Inc. is a holding company, which engages in the provision of financial services. It operates through the following segments: Retail Banking, Corporate and Institutional Banking, Asset Management Group, and Other. The Retail Banking segment offers deposit, lending, brokerage, investment management, and cash management products and services to consumer and small business customers. The Corporate and Institutional segment covers the lending, treasury management, and capital markets-related products and services to mid-sized and large corporations, government, and not-for-profit entities. The Asset Management Group segment includes personal wealth management for high net worth and ultra-high net worth clients and institutional asset management. The company was founded in 1983 and is headquartered in Pittsburgh, PA."
POOL,Pool Corp.,109 Northpark Boulevard,"Covington, Louisiana 70433-5521",Sports Goods,"Pool Corp. engages in the wholesale distribution of swimming pool supplies, equipment, and related leisure products. It also offers non-discretionary pool maintenance products such as chemicals and replacement parts, discretionary products like packaged pool kits, whole goods, irrigation, and landscape products, including a complete line of commercial and residential irrigation products and parts, power equipment for the professional landscape market, specialty products such as outdoor lighting, grills, and outdoor kitchen components, and golf irrigation and water management products. The company was founded in 1993 and is headquartered in Covington, LA."
PPG,PPG Industries Inc.,One PPG Place,"Pittsburgh, Pennsylvania 15272",Building Materials/Products,"PPG Industries, Inc. engages in the manufacture and distribution of paints, coatings, and specialty materials. It operates through the Performance Coatings and Industrial Coatings segments. The Performance Coatings segment supplies a variety of protective and decorative coatings, sealants, and finishes along with pavement marking products, paint strippers, stains, and related chemicals, as well as transparencies and transparent armor. The Industrial Coatings segment includes a variety of protective and decorative coatings and finishes along with adhesives, sealants, metal pretreatment products, optical monomers and coatings, low-friction coatings, precipitated silicas, and other specialty materials. The company was founded by John B. Ford and John A. Pitcairn in 1883 and is headquartered in Pittsburgh, PA."
PPL,PPL Corp.,2 North Ninth Street,"Allentown, Pennsylvania 18101-1179",Electric Utilities,"PPL Corp. engages in the generation, transmission and distribution of electricity. It operates through the two reportable segments: Kentucky Regulated & Pennsylvania Regulated. The Kentucky Regulated segment consists of LKE's regulated electricity generation, transmission and distribution operations of Louisville Gas and Electric Company and Kentucky Utilities Company as well as regulated distribution and sale of natural gas of Louisville Gas and Electric Company. The Pennsylvania Regulated segment consists of the regulated electricity transmission and distribution operations of PPL Electric Utilities Corporation. The company was founded in 1994 and is headquartered in Allentown, PA."
PFG,Principal Financial Group Inc.,711 High Street,"Des Moines, Iowa 50392",Life Insurance,"Principal Financial Group, Inc. engages in the investment management offering business. It offers financial products and services to businesses, individuals, and institutional clients. It operates its business through following segments: Retirement and Income Solutions, Principal Global Investors, Principal International, U.S. Insurance Solutions, and Corporate. The Retirement and Income Solutions segment provides retirement and related financial products and services primarily to businesses, their employees, and other individuals. The Principal Global Investors segment is involved in asset management services to asset accumulation business, insurance operations, corporate segment and third-party clients, and also refers to the mutual fund business. The Principal International segment offers pension accumulation products and services, mutual funds, asset management, income annuities and life insurance accumulation products. The U.S. Insurance Solutions segment includes the specialty benefits insurance division and consists of group dental and vision insurance, individual and group disability insurance, group life insurance and non-medical fee-for-service claims administration, and the individual life insurance division, which provides solutions for small & medium-sized businesses. The Corporate segment manages the assets representing capital that has not been allocated to any other segment. The company was founded by Edward A. Temple in 1879 and is headquartered in Des Moines, IA."
PG,Procter & Gamble Co.,1 Procter & Gamble Plaza,"Cincinnati, Ohio 45202-3315",Personal Care Products/Appliances,"Procter & Gamble Co. engages in the provision of branded consumer packaged goods. It operates through the following segments: Beauty, Grooming, Health Care, Fabric and Home Care, and Baby, Feminine and Family Care. The Beauty segment offers hair, skin, and personal care. The Grooming segment consists of shave care like female and male blades and razors, pre and post shave products, and appliances. The Health Care segment includes oral care products like toothbrushes, toothpaste, and personal health care such as gastrointestinal, rapid diagnostics, respiratory, and vitamins, minerals, and supplements. The Fabric and Home care segment consists of fabric enhancers, laundry additives and detergents, and air, dish, and surface care. The Baby, Feminine and Family Care segment sells baby wipes, diapers, and pants, adult incontinence, feminine care, paper towels, tissues, and toilet paper. The company was founded by William Procter and James Gamble in 1837 and is headquartered in Cincinnati, OH."
PGR,Progressive Corp.,6300 Wilson Mills Road,"Mayfield Village, Ohio 44143-9998",Non-Life Insurance,"Progressive Corp. is an insurance holding company, which engages in the provision of personal and commercial auto insurance, residential property insurance, and other specialty property-casualty insurance and related services. It operates through the following segments: Personal Lines, Commercial Lines, and Property. The Personal Lines segment includes agency and direct businesses. The Commercial Lines segment writes primary liability and physical damage insurance for automobiles and trucks owned and operated predominately by small business in the auto, for-hire transportation, contractor, for-hire specialty, tow, and for-hire livery markets. The Property segment covers residential property insurance for homeowners, other property owners, and renters. The company was founded on March 10, 1937, and is headquartered in Mayfield Village, OH."
PLD,Prologis Inc.,Pier 1,Bay 1,Industrial/Office REITs,"Prologis, Inc. engages in providing logistics solutions and services. It operates through the Real Estate and Strategic Capital segments. The Real Estate segment includes rental operations and development. The Strategic Capital segment represents the management of co-investment ventures and other unconsolidated entities. The company was founded by Hamid R. Moghadam in 1991 and is headquartered in San Francisco, CA."
PRU,Prudential Financial Inc.,751 Broad Street,23rd floor,Life Insurance,"Prudential Financial, Inc. engages in the provision of insurance, investment management, and other financial products and services to both individual and institutional customers. It operates through the following segments: PGIM, U.S. Businesses, International Businesses, Closed Block, and Corporate and Others. The PGIM segment provides investment management services and solutions related to public fixed income, public equity, real estate debt and equity, private credit and other alternatives, and multi-asset class strategies, to institutional and retail clients globally, as well as the Company’s general account. The U.S. Businesses segment offers a range of products and solutions that cover protection, retirement, savings, income and investment needs. The U.S. Businesses are organized into five segments: Retirement, Group Insurance, Individual Annuities, Individual Life and Assurance IQ. The Retirement segment provides retirement investment and income products and services to retirement plan sponsors in the public, private, and not-for-profit sectors. The Group Insurance segment provides group life, long-term and short-term group disability, and group corporate bank, and trust-owned life insurance in the U.S., primarily to institutional clients for use in connection with employee plans and affinity groups. The Individual Annuities segment develops and distributes individual variable and fixed annuity products, primarily to the U.S. mass affluent and affluent markets. The Individual Life segment develops and distributes individual variable life, term life and universal life insurance products primarily to the U.S. mass middle, mass affluent and affluent markets. The Assurance IQ segment leverages data science and technology to primarily distribute third-party products and a proprietary term life product directly to retail shoppers, primarily through its digital and agent channels. The International Businesses segment develops and distributes life insurance, retirement, and related products to the mass affluent and affluent markets in Japan, Korea, and other foreign countries through its Life Planner operations. The Closed Block segment includes certain in force participating insurance and annuity products and corresponding assets that are used for the payment of benefits, expenses and policyholders’ dividends related to these products. The Corporate and Other Operations segment include corporate items and initiatives that are not allocated to business segments. The company was founded by John Fairfield Dryden in 1875 and is headquartered in Newark, NJ."
PEG,Public Service Enterprise Group Inc.,80 Park Plaza,"Newark, New Jersey 07102-4109",Multiutilities,"Public Service Enterprise Group, Inc. is an energy company, which engages in the business of regulated electric and gas utility, and nuclear generation. Its products and services include energy, capacity, ancillary services, and emissions allowances and congestion credits. The firm operates through the Public Service Electric and Gas Company (PSE&G) and PSEG Power segments. The PSE&G segment focuses on the transmission of electricity and distribution of electricity and natural gas. The PSEG Power segment wholesales energy, fuel supply, and energy transacting functions. The company was founded in 1903 and is headquartered in Newark, NJ."
PTC,PTC Inc.,121 Seaport Boulevard,"Boston, Massachusetts 02210",Software,"PTC, Inc. is a global software company, which engages in the provision of a portfolio of innovative digital solutions that work together to transform how physical products are engineered, manufactured, and serviced. Its products include Windchill, Creo, ThingWorx, Vuforia, Codebeamer, Arbortext, Arena, and Onshape. The company was founded in 1985 and is headquartered in Boston, MA."
PSA,Public Storage,701 Western Avenue,2nd floor,Specialty REITs,"Public Storage operates as a real estate investment trust, which engages in acquiring, developing, owning and operating self-storage facilities. It operates through the following segments: Self-storage Operations, Ancillary Operations, and Other Items. The Self-storage Operations segment reflects the rental operations from all self-storage facilities. The Ancillary Operations segment deals with the sale of merchandise and reinsurance of policies against losses to goods stored by self-storage tenants, activities which are incidental to the primary self-storage rental activities. The Other Items segment includes general, administrative, and investment costs. The company was founded by Bradley Wayne Hughes, Sr. and Kenneth Q. Volk, Jr. in 1972 and is headquartered in Glendale, CA."
PHM,PulteGroup Inc.,3350 Peachtree Road NE,Suite 150,Residential Building Construction,"PulteGroup, Inc. engages in the homebuilding business. The firm is also involved in mortgage banking and title and insurance brokerage operations. It operates through the Homebuilding and Financial services business segments. The Homebuilding segment includes operations from Connecticut, Maryland, Massachusetts, New Jersey, New York, Pennsylvania, Virginia, Georgia, North Carolina, South Carolina, Tennessee, Florida, Illinois, Indiana, Kentucky, Michigan, Minnesota, Missouri, Ohio, Texas, Arizona, California, Nevada, New Mexico, and Washington. The Financial Services segment is composed of mortgage banking and title operations. The company was founded by William J. Pulte in 1950 and is headquartered in Atlanta, GA."
QRVO,Qorvo Inc.,7628 Thorndike Road,"Greensboro, North Carolina 27409-9421",Semiconductors,"Qorvo, Inc. provides semiconductor solutions for RF and power. The firm combines product and technology leadership, systems-level expertise, and global manufacturing scale to quickly solve its customers’ most complex technical challenges. Qorvo serves diverse high-growth segments of large global markets, including consumer electronics, smart home/IoT, automotive, EVs, battery-powered appliances, network infrastructure, healthcare, and aerospace/defense. It operates through the following segments: High Performance Analog (HPA), Connectivity and Sensors Group (CSG), and Advanced Cellular Group (ACG). The HPA segment supplies RF and power management solutions for infrastructure, defense and aerospace, automotive power, and other markets. The CSG segment supplies connectivity and sensor components and systems featuring multiple technologies such as UWB, Matter, Bluetooth Low Energy, Zigbee, Thread, Wi-Fi, cellular IoT and MEMS-/BAW-based sensors. The ACG segment supplies cellular RF solutions for smartphones, wearables, laptops, tablets, and various other devices. The company was formed following the merger of RF Micro Devices, founded in 2015, and TriQuint Semiconductor, incorporated in 1981. It is headquartered in Greensboro, NC."
PWR,Quanta Services Inc.,2727 North Loop West,"Houston, Texas 77008",Construction,"Quanta Services, Inc. engages in the provision of comprehensive infrastructure solutions to the electric power, oil and gas, and communication industries. It operates through the following segments: Electric Power Infrastructure Solutions, Renewable Energy Infrastructure Solutions, and Underground Utility and Infrastructure Solutions. The Electric Power Infrastructure Services segment provides network solutions to customers in the electric power industry. The Renewable Energy Infrastructure Solutions focuses on comprehensive infrastructure solutions to customers that are involved in the renewable energy industry. The Underground Utility and Infrastructure Solutions segment offers comprehensive infrastructure solutions to customers involved in the development, transportation, distribution, storage and processing of natural gas, oil and other products. The company was founded by Kevin D. Miller, Steven P. Colmar, William G. Parkhouse and John R. Colson on August 19, 1997, and is headquartered in Houston, TX."
QCOM,Qualcomm Inc.,5775 Morehouse Drive,"San Diego, California 92121-1714",Semiconductors,"QUALCOMM, Inc. engages in the development, design, and provision of digital telecommunications products and services. It operates through the following segments: Qualcomm CDMA Technologies (QCT), Qualcomm Technology Licensing (QTL), and Qualcomm Strategic Initiatives (QSI). The QCT segment develops and supplies integrated circuits and system software based on technologies for the use in voice and data communications, networking, application processing, multimedia, and global positioning system products. The QTL segment grants licenses and provides rights to use portions of the firm's intellectual property portfolio. The QSI segment focuses on opening new or expanding opportunities for its technologies and supporting the design and introduction of new products and services for voice and data communications. The company was founded by Franklin P. Antonio, Adelia A. Coffman, Andrew Cohen, Klein Gilhousen, Irwin Mark Jacobs, Andrew J. Viterbi, and Harvey P. White in July 1985 and is headquartered in San Diego, CA."
DGX,Quest Diagnostics Inc.,500 Plaza Drive,"Secaucus, New Jersey 07940",Healthcare Provision,"Quest Diagnostics, Inc. engages in the provision of diagnostic testing, information and services. It operates through the Diagnostic Information Services (DIS) and All Other segments. The DIS segment offers diagnostic information services to patients, clinicians, hospitals, health plans, and employers. The All Other segment consists of risk assessment services, healthcare information technology, diagnostic products, and clinical trials testing businesses. The company was founded in 1967 and is headquartered in Secaucus, NJ."
