symbol,name,address1,address2,industry,summary
C,Citigroup Inc.,388 Greenwich Street,"New York, New York 10013",Major International Banks,"Citigroup, Inc. is a holding company, which engages in the provision of financial products and services. It operates through the following segments: Global Consumer Banking, Institutional Clients Group, and Corporate and Other. The Global Consumer Banking segment provides traditional banking services to retail customers through retail banking, including commercial banking, and Citi-branded cards and Citi retail services. The Institutional Clients Group segment provides corporate, institutional, public sector and high-net-worth clients around the world with a full range of wholesale banking products and services. This segment includes fixed income and equity sales and trading, foreign exchange, prime brokerage, derivative services, equity and fixed income research, corporate lending, investment banking and advisory services, private banking, cash management, trade finance and securities services. The Corporate and Other segment includes certain unallocated costs of global staff functions, other corporate expenses and unallocated global operations and technology expenses, Corporate Treasury, certain North America and international legacy consumer loan portfolios, other legacy assets, and discontinued operations. The company was founded in 1812 and is headquartered in New York, NY."
CFG,Citizens Financial Group Inc.,One Citizens Plaza,"Providence, Rhode Island 02903",Banking,"Citizens Financial Group, Inc. engages in the provision of commercial banking services. It operates through the Consumer Banking and Commercial Banking segments. The Consumer Banking segment includes deposit products, mortgage and home equity lending, student loans, auto financing, credit cards, business loans, and wealth management and investment services. The Commercial Banking segment offers lending and leasing, trade financing, deposit and treasury management, foreign exchange and interest rate risk management, corporate finance and debt, and equity capital markets. The company was founded in 1828 and is headquartered in Providence, RI."
CLX,Clorox Co.,1221 Broadway,"Oakland, California 94612-1888",Nondurable Household Products,"The Clorox Co. engages in the manufacture and marketing of consumer and professional products. It operates through the following business segments: Health and Wellness, Household, Lifestyle, and International. The Health and Wellness segment consists of cleaning products, professional products and vitamins, minerals and supplements mainly marketed and sold in the United States. The Household segments consists of bags and wraps, grilling products and cat litter marketed and sold in the United States. The Lifestyle segment refers to food, natural personal care products and water-filtration products marketed and sold in the United States. The International segment covers products sold outside the United States, excluding natural personal care products. The company was founded by Edward Hughes, Charles Husband, William Hussey, Rufus Myers, and Archibald Taft on May 3, 1913 and is headquartered in Oakland, CA."
CME,CME Group Inc. Cl A,20 South Wacker Drive,"Chicago, Illinois 60606",Securities,"CME Group, Inc. operates a derivatives marketplace, which offers a range of futures and options products for risk management. Its exchanges offer a range of global benchmark products across all major asset classes based on interest rates, equity indexes, foreign exchange (FX), energy, agricultural commodities and metals. It offers futures and options on futures trading across asset classes through the CME Globex platform, fixed income trading via BrokerTec and FX trading on the EBS platform. In addition, it also operates CME Clearing, a central counterparty clearing provider. The company was founded in 1898 and is headquartered in Chicago, IL."
CMS,CMS Energy Corp.,One Energy Plaza,"Jackson, Michigan 49201-2357",Electric Utilities,"CMS Energy Corp. engages in the provision of electric and natural gas activities. It operates through the following business segments: Electric Utility, Gas Utility, and NorthStar Clean Energy. The Electric Utility segment focuses on generation, purchase, distribution, and sale of electricity. The Gas Utility segment includes purchase, transmission, storage, distribution, and sale of natural gas. The NorthStar Clean Energy segment is involved in domestic independent power production including the development and operation of renewable generation and the marketing of independent power production. The company was founded in 1987 and is headquartered in Jackson, MI."
KO,Coca-Cola Co.,One Coca-Cola Plaza,"Atlanta, Georgia 30313-2420",Non-Alcoholic Beverages/Drinks,"The Coca-Cola Co. engages in the manufacturing and marketing of non-alcoholic beverages. It operates through the following segments: Europe, Middle East and Africa, Latin America, North America, Asia Pacific, Global Ventures, and Bottling Investments. The company was founded by Asa Griggs Candler on May 8, 1886 and is headquartered in Atlanta, GA."
CTSH,Cognizant Technology Solutions Corp.,300 Frank West Burr Boulevard,"Teaneck, New Jersey 07666",Software,"Cognizant Technology Solutions Corp. engages in the provision of information technology, consulting, and business process outsourcing services. It operates through the following business segments: Financial Services, Healthcare, Products and Resources, and Communications, Media, and Technology. The Financial Services segment consists of banking and insurance services. The Healthcare segment involves healthcare and life sciences. The Products and Resources segment consists of retail and consumer goods, manufacturing and logistics, travel and hospitality, and energy and utilities. The Communications, Media, and Technology segment includes communications, information, media and entertainment, and technology. The company was founded by Wijeyaraj Kumar Mahadeva and Francisco D'Souza in 1994 and is headquartered in Teaneck, NJ."
CL,Colgate-Palmolive Co.,300 Park Avenue,"New York, New York 10022-7499",Personal Care Products/Appliances,"Colgate-Palmolive Co. is engaged in the manufacturing and distribution of consumer products. It operates through the Oral, Personal and Home Care, and Pet Nutrition segments. The Oral, Personal and Home Care segment represents North America, Latin America, Europe, Asia Pacific, and Africa or Eurasia, all of which sell to a variety of retail and wholesale customers and distributors. The Pet Nutrition segment offers pet nutrition products for dogs and cats. The company was founded by William Colgate in 1806 and is headquartered in New York, NY."
CMCSA,Comcast Corp. Cl A,One Comcast Center,1701 John F. Kennedy Boulevard,Broadcasting,"Comcast Corp. engages in the provision of video, Internet, and phone services. It operates through the following segments: Cable Communications, Media, Studios, Theme Parks, and Sky. The Cable Communications segment consists of Comcast Cable, which is a provider of broadband, video, voice, wireless, and other services to residential customers in the United States under the Xfinity brand. The Media segment consists of NBCUniversal’s television and streaming platforms, including national, regional, and international cable networks. The Studios segment focuses on NBCUniversal’s film and television studio production and distribution operations. The Theme Parks segment operates Universal theme parks in Orlando, Florida, Hollywood, California, Osaka, Japan, and Beijing, China. The Sky segment provides operations of Sky, one of Europe’s entertainment companies, which primarily includes a direct-to-consumer business, providing video, broadband, voice and wireless phone services, and a content business, operating entertainment networks, the Sky News broadcast network, and Sky Sports networks. The company was founded in 1963 and is headquartered in Philadelphia, PA."
CMA,Comerica Inc.,Comerica Bank Tower,1717 Main Street,Banking,"Comerica, Inc. engages in the provision of financial services. It operates through the following segments: Commercial Bank, Retail Bank, Wealth Management, Finance, and Other. The Commercial Bank segment offers various products and services, including commercial loans and lines of credit, deposits, cash management, capital market products, international trade finance, letters of credit, foreign exchange management services, and loan syndication services. The Retail Bank segment includes personal financial services, consisting of consumer lending, consumer deposit gathering and mortgage loan origination, and offers consumer products, including deposit accounts, installment loans, credit cards, student loans, home equity lines of credit, and residential mortgage loans. The Wealth Management segment offers fiduciary services, private banking, retirement services, investment management and advisory services, investment banking, and brokerage services. The Finance segment includes the corporation's securities portfolio and asset and liability management activities. The Other segment includes the income and expense impact of equity and cash, tax benefits, charges of an unusual or infrequent nature that are not reflective of the normal operations, and miscellaneous other expenses of a corporate nature. The company was founded in 1973 and is headquartered in Dallas, TX."
CAG,Conagra Brands Inc.,222 West Merchandise Mart Plaza,Suite 1300,Food Products,"Conagra Brands, Inc. engages in the manufacture and sale of processed and packaged foods. It operates through the following segments: Grocery and Snacks, Refrigerated and Frozen, International, and Foodservice. The Grocery and Snacks segment includes branded, shelf stable food products sold in various retail channels in the United States. The Refrigerated and Frozen segment is composed of branded, temperature-controlled food products sold in various retail channels in the United States. The International segment offers branded food products in various temperature states, sold in various retail and foodservice channels outside of the United States. The Foodservice segment focuses on branded and customized food products, including meals, entrees, sauces, and a variety of custom-manufactured culinary products packaged for sale to restaurants and other foodservice establishments in the United States. The company was founded by Alva Kinney and Frank Little in 1919 and is headquartered in Chicago, IL."
COP,ConocoPhillips,925 North Eldridge Parkway,"Houston, Texas 77079",Major Oil & Natural Gas Companies,"ConocoPhillips engages in the exploration, production, transportation and marketing of crude oil, bitumen, natural gas, natural gas liquids, and liquefied natural gas on a worldwide basis. It operates through the following geographical segments: Alaska, Lower 48, Canada, Europe, Middle East and North Africa, Asia Pacific, and Other International. The Alaska segment primarily explores for, produces, transports, and markets crude oil, natural gas, and natural gas liquids. The Lower 48 segment consists of operations in the U.S. and the Gulf of Mexico. The Canada segment consists of oil sands development in the Athabasca Region of northeastern Alberta and a liquids-rich unconventional play in western Canada. The Europe, Middle East and North Africa segment consists of operations and exploration activities in Norway, the United Kingdom and Libya. The Asia Pacific segment has explorations and product operations in China, Indonesia, Malaysia, and Australia. The Other International segment handles exploration activities in Columbia and Argentina. The company was founded in 1875 and is headquartered in Houston, TX."
ED,Consolidated Edison Inc.,4 Irving Place,"New York, New York 10003",Multiutilities,"Consolidated Edison, Inc. is a holding company, which engages in the business of regulated electric, gas, and steam delivery. It operates through the following segments: Consolidated Edison Company of New York (CECONY), Orange and Rockland Utilities(O&R), Con Edison Clean Energy Businesses and Con Edison Transmission. The CECONY segment is involved in the regulated electric, gas, and steam utility businesses. The O&R segment covers regulated electric and gas utility delivery businesses. The Con Edison Clean Energy Businesses segment develops, owns, and operates renewable and energy infrastructure projects and provides energy-related products and services to wholesale and retail customers. The Con Edison Transmission segment invests in electric and gas transmission projects. The company was founded in 1823 and is headquartered in New York, NY."
STZ,Constellation Brands Inc. Cl A,207 High Point Drive,Building 100,Alcoholic Beverages/Drinks,"Constellation Brands, Inc. engages in the production, marketing, and distribution of beer, wine, and spirits. It operates through the following segments: Beer, Wine and Spirits, Corporate Operations and Other, and Canopy. The Beer segment includes imported and craft beer brands. The Wine and Spirits segment sells wine brands across all categories-table wine, sparkling wine, and dessert wine-and across all price points. The Corporate Operations and Other segment refers to the costs of executive management, corporate development, corporate finance, human resources, internal audit, investor relations, legal, public relations, and information technology. The Canopy segment consists of canopy equity method Investments. The company was founded by Marvin Sands in 1945 and is headquartered in Victor, NY."
CEG,Constellation Energy Corp.,1310 Point Street,"Baltimore, Maryland 21231-3380",Electric Utilities,"Constellation Energy Corp. engages in the generation, supply, and marketing of clean energy electricity, and renewable energy products and solutions. It operates under the following geographical segments: Mid-Atlantic, Midwest, New York, Texas, and Other Power Regions Segment. The company is headquartered in Baltimore, MD."
COO,Cooper Cos.,6101 Bollinger Canyon Road,Suite 500,Medical Equipment/Supplies,"The Cooper Cos, Inc. operates as a medical device company. It operates through the Cooper Vision and Cooper Surgical segments. The Cooper Vision segment develops, manufactures, and markets products for contact lens wearers, which solves vision challenges such as astigmatism, presbyopia, myopia, ocular dryness, and eye fatigues. The Cooper Surgical segment focuses on the provision of advancement for the health of women, babies, and families through women's health and fertility products and services. The company was founded in 1958 and is headquartered in San Ramon, CA."
CPRT,Copart Inc.,14185 Dallas Parkway,Suite 300,Mixed Retailing,"Copart, Inc. engages in the provision of online auctions and vehicle remarketing services. It provides vehicle sellers with a full range of services to process and sell vehicles primarily over the internet through Virtual Bidding Third Generation Internet auction-style sales technology. The firm sells the vehicles principally to licensed vehicle dismantlers, rebuilders, repair licensees, used vehicle dealers, and exporters and at certain locations, as well as to the general public. The company’s services include online seller access, salvage estimation services, estimating services, end-of-life vehicle processing, virtual insured exchange, transportation services, vehicle inspection stations, on-demand reporting, DMV processing, and vehicle processing programs. It operates through the United States and International segments. Copart was founded by Willis J. Johnson in 1982 and is headquartered in Dallas, TX."
GLW,Corning Inc.,One Riverfront Plaza,"Corning, New York 14831",Industrial Products,"Corning, Inc. engages in the provision of glass for notebook computers, flat panel desktop monitors, display televisions, and other information display applications, carrier network and enterprise network products for the telecommunications industry, ceramic substrates for gasoline and diesel engines in automotive and heavy-duty vehicle markets, laboratory products for the scientific community and polymer products for biotechnology applications, optical materials for the semiconductor industry and the scientific community, and polycrystalline silicon products and other technologies. It operates through the following business segments: Display Technologies, Optical Communications, Environmental Technologies, Specialty Materials, and Life Sciences. The Display Technologies segment manufactures glass substrates for flat panel displays, including organic light-emitting diodes and liquid crystal displays that are used primarily in televisions, notebook computer, desktop monitors, tablets, and handheld devices. The Optical Communications segment is classified into two main product groupings: carrier and enterprise network. The carrier network group consists primarily of products and solutions for optical-based communications infrastructure for services such as video, data, and voice communications. The enterprise network group consists primarily of optical-based communication networks sold to businesses, governments, and individuals for their own use. The Environmental Technologies segment manufactures ceramic substrates and filter products for emissions control in mobile and stationary applications. The Specialty Materials segment engages in the manufacture of products that provide material formulations for glass, glass ceramics and crystals, and precision metrology instruments and software. The Life Sciences segment develops, manufactures, and supplies laboratory products. The company was founded by Amory Houghton Sr. in 1851 and is headquartered in Corning, NY."
CTVA,Corteva Inc.,9330 Zionsville Road,"Indianapolis, Indiana 46268",Chemicals,"Corteva, Inc. engages in the provision of seed and crop protection solutions, which focus on the agriculture industry and contributing to food supply. It operates through the Seed and Crop Protection segments. The Seed segment is involved in developing and supplying advanced germplasm and traits that produce yield for farms. The Crop Protection segment offers the global agricultural input industry with products that protect against weeds, insects, other pests, and diseases, and that improve overall crop health both above and below ground via nitrogen management and seed-applied technologies. The company was founded in 1802 and is headquartered in Indianapolis, IN."
CSGP,CoStar Group Inc.,"1331 L Street, North West","Washington, District of Columbia 20005",Diversified Business Services,"CoStar Group, Inc. engages in providing online real estate marketplaces, information, and analytics in the commercial and residential property markets. It operates through the North America and International geographical segments. The North America segment includes the Unites States and Canada. The International refers to Europe, Asia-Pacific, and Latin America. The company was founded by Andrew C. Florance and Michael R. Klein in 1987 and is headquartered in Washington, DC."
COST,Costco Wholesale Corp.,999 Lake Drive,"Issaquah, Washington 98027-8990",Mixed Retailing,"Costco Wholesale Corp. engages in the operation of membership warehouses through wholly owned subsidiaries. It operates through the following geographical segments: United States, Canada, and Other International Operations. The company was founded by James D. Sinegal and Jeffrey H. Brotman in 1983 and is headquartered in Issaquah, WA."
CTRA,Coterra Energy Inc.,Three Memorial City Plaza,840 Gessner Road,Upstream Oil & Gas,"Coterra Energy Inc. is a diversified energy company, which engages in the exploration, development, and production of oil and natural gas properties. Its portfolio includes projects in the Permian Basin, the Marcellus Shale, and the Anadarko Basin. The company was renamed to Coterra Energy Inc. on October 1, 2021 in connection with the merger involving Cabot Oil & Gas Corp. and Cimarex Energy Co. Coterra Energy was founded in 1989 and is headquartered in Houston, TX."
CCI,Crown Castle Inc.,8020 Katy Freeway,"Houston, Texas 77024-1908",Specialty REITs,"Crown Castle, Inc. is a real estate investment trust company, which engages in the provision of access to wireless infrastructure via long-term contacts. It operates through the Towers and Fiber segments. The Towers segment offers access, including space or capacity towers dispersed throughout the United States. The Fiber segment covers access, including space or capacity of fiber primarily supporting small cell networks and fiber solutions. The company was founded by Ted B. Miller Jr. and Edward C. Hutcheson Jr. in 1994 and is headquartered in Houston, TX."
CSX,CSX Corp.,500 Water Street,15th floor,Railroads,"CSX Corp. engages in the provision of rail-based freight transportation services. Its services include rail service, the transport of intermodal containers and trailers, rail-to-truck transfers and bulk commodity operations. The company was founded in 1827 and is headquartered in Jacksonville, FL."
CMI,Cummins Inc.,500 Jackson Street,"Columbus, Indiana 47202-3005",Motor Vehicle Parts,"Cummins, Inc. engages in the design, manufacture, and market of diesel and natural gas engines. It operates through the following segments: Engine, Distribution, Components, Power Systems, and New Power. The Engine segment manufactures and markets diesel and natural gas-powered engines under the Cummins brand name, for the heavy- and medium-duty truck, bus, recreational vehicle, light-duty automotive, construction, mining, marine, rail, oil and gas, defense, and agricultural markets. The Distribution segment consists of parts, engines, power generation, and service which service and distribute its products and services. The Components segment supplies products such as aftertreatment systems, turbochargers, transmissions, filtration products, electronics and fuel systems for commercial diesel, and natural gas applications. The Power Systems segment engages in power generation, industrial, and generator technologies. The New Power segment designs, manufactures, sells, and supports hydrogen production solutions, as well as electrified power systems ranging from fully electric to hybrid along with components and subsystems, including battery and fuel cell technologies. The company was founded by Clessie Lyle Cummins and William Glanton Irwin on February 3, 1919 and is headquartered in Columbus, IN."
CVS,CVS Health Corp.,One CVS Drive,"Woonsocket, Rhode Island 02895",Drug Retail,"CVS Health Corp. is a health solutions company, which engages in the provision of healthcare services. It operates through the following segments: Pharmacy Services, Retail or Long-Term Care, Health Care Benefits, and Corporate and Other. The Pharmacy Services segment focuses on the pharmacy benefit management solutions. The Retail or Long-Term Care segment includes the sale of prescription drugs and an assortment of health and wellness products, and general merchandise. The Health Care Benefits segment offers traditional, voluntary, and consumer-directed health insurance products and related services, including medical, pharmacy, dental and behavioral health plans, medical management capabilities, Medicare Advantage and Medicare Supplement plans, Medicare Part D prescription drug plan, Medicaid health care management services, and health information technology products and services. The Corporate and Other segment is involved in providing management and administrative services. The company was founded by Stanley P. Goldstein and Ralph Hoagland in 1963 and is headquartered in Woonsocket, RI."
DHI,D.R. Horton Inc.,1341 Horton Circle,"Arlington, Texas 76011",Residential Building Construction,"D.R. Horton, Inc. is a homebuilding company, which engages in the construction and sale of single-family housing. It operates through the following geographical segments: Northwest, Southwest, South Central, Southeast, East, and North. The Northwest segment includes Colorado, Oregon, Utah, and Washington. The Southwest segment includes Arizona, California, Hawaii, Nevada, and New Mexico. The South Central segment focuses on Arkansas, Oklahoma, and Texas. The Southeast segment includes Alabama, Florida, Louisiana, and Mississippi. The East segment includes Georgia, North Carolina, South Carolina, and Tennessee. The North segment focuses on Delaware, Illinois, Indiana, Iowa, Kentucky, Maryland, Minnesota, Nebraska, New Jersey, Ohio, Pennsylvania, Virginia, and West Virginia. The company was founded by Donald Ray Horton in 1978 and is headquartered in Arlington, TX."
DHR,Danaher Corp.,2200 Pennsylvania Avenue North West,Suite 800 West,Medical Equipment/Supplies,"Danaher Corp. engages in the design, manufacture, and marketing of professional, medical, industrial, and commercial products and services. It operates through the following segments: Biotechnology, Life Sciences, Diagnostics, and Environmental and Applied Solutions. The Biotechnology segment includes the bioprocessing and discovery and medical businesses and offers a range of tools, consumables, and services. The Life Sciences segment offers a range of instruments and consumables to study the basic building blocks of life, including DNA and RNA. The Diagnostics segment offers clinical instruments, reagents, consumables, software, and services used to diagnose disease and make treatment decisions. The Environmental and Applied Solution segment offers products and services that help protect important resources and keep global food and water supplies safe. The company was founded by Steven M. Rales and Mitchell P. Rales in 1984 and is headquartered in Washington, DC."
